### ISSUE TITLE
ImLive.com plugin 

### ISSUE THREAD

**Issue by johnthecracker** [streamlink/streamlink#707]
### Checklist

- [ ] This is a bug report.
- [x] This is a plugin request.
- [ ] This is a feature request.
- [x] I used the search function to find already opened/closed issues or pull requests.

### Description

This is some sort of hybrid stream. It is time to move on from old ways and find new ways
to watch streams.

### Expected / Actual behavior

Expected to watch free stream easily in player. Cannot watch HTTP stream in player.
 I cannot put dynamic HTTP chunks together.

RTMP stream can be watched with KSV Rtmpdump and output piped to player,
or with FFMPEG ( ffplay.exe ).

### Reproduction steps / Stream URLs to test

1. https://imlive.com/live-sex-chats/cam-girls/
2. any "model"
3. https://imlive.com/flash_sdk/FreeVideoChatGuest.aspx?hostnick=rubyamesx&roomid=10
4. https://streamer12.wlmediahub.com/flc/1230585/rubyamesx_0.mp4?a=0.9497994491830468

### Environment details (operating system, python version, etc.)

windows 7 64

### Comments, logs, screenshots, etc.

Any feedback is welcome.

**Comment by johnthecracker** [comment]
rtmpdump2.4 KSV ( rtmpsuck ) crushes.



This is the best what I get: windows 7, rtmpdumphelper, rtmpdump2.3

Logged in as a member ( freeloader ).



RTMPSUCK:


RTMP Proxy Server v2.3
(c) 2010 Andrej Stepanchuk, Howard Chu; license: GPL

Streaming on rtmp://0.0.0.0:1935
WARNING: Trying different position for client digest!
Processing connect
app: Decryption/
flashVer: WIN 25,0,0,127
swfUrl: https://imlive.com/swf/genericguestapp.swf
ERROR: HTTP_get, TLS_Connect failed
ERROR: RTMP_HashSWF: connection lost while downloading swfurl https://imlive.com
/swf/genericguestapp.swf
tcUrl: rtmp://fly20.globalmailer.com/Decryption/
pageUrl: https://imlive.com/flash_sdk/freevideochatguest.aspx?hostnick=joennacut
e_&roomid=10
ERROR: RTMP_ReadPacket, failed to read RTMP packet header
Closing connection... done!

WARNING: Trying different position for client digest!
Processing connect
app: coolVideo_v2/1110710
flashVer: WIN 25,0,0,127
swfUrl: https://imlive.com/swf/genericguestapp.swf
ERROR: HTTP_get, TLS_Connect failed
ERROR: RTMP_HashSWF: connection lost while downloading swfurl https://imlive.com
/swf/genericguestapp.swf
tcUrl: rtmp://fly20.globalmailer.com/coolVideo_v2/1110710
pageUrl: https://imlive.com/flash_sdk/freevideochatguest.aspx?hostnick=joennacut
e_&roomid=10
Playpath: joennacute_
Saving as: joennacute_


nothing saved.
¯¯¯¯¯¯¯¯¯¯¯¯¯¯¯¯


RTMPSRV stays idle:

RTMP Server v2.3
(c) 2010 Andrej Stepanchuk, Howard Chu; license: GPL

Streaming on rtmp://0.0.0.0:1935
WARNING: Trying different position for client digest!

**Comment by johnthecracker** [comment]
Beardypig,

This one is for you.

http://stream-recorder.com/forum/showpost.php?p=90311&postcount=6

**Comment by johnthecracker** [comment]
I get this chunk from firefox extension LiveHttpHeaders to play for 15 seconds:

https://streamer8.wlmediahub.com/flc/1069080/jessieblonde_0.mp4?a=0.7783241104334593

**Comment by johnthecracker** [comment]
This is as close as I get to rtmp strea.

![screenshot](https://cloud.githubusercontent.com/assets/25414991/24022831/9e31457a-0aa0-11e7-9225-ce8e1572977d.jpg)

**Comment by johnthecracker** [comment]
closed by mistake, reopened.

**Comment by johnthecracker** [comment]
This is as close as I get to RTMP stream.

![screenshot](https://cloud.githubusercontent.com/assets/25414991/24023337/9878b67e-0aa3-11e7-92c1-836c92b23650.jpg)

**Comment by johnthecracker** [comment]
Frame 5347: 1154 bytes on wire (9232 bits), 1154 bytes captured (9232 bits) on interface 0
Ethernet II, Src: ----------------------
Internet Protocol Version 4, Src: 192.168.0.2, Dst: 66.6.18.100
Transmission Control Protocol, Src Port: 55019, Dst Port: 1935, Seq: 5634, Ack: 3074, Len: 1100
Real Time Messaging Protocol (AMF0 Command connect('coolVideo_v2/914385'))
    Response to this call in frame: 5822
    RTMP Header
    RTMP Body
        String 'connect'
        Number 1
        Object (11 items)
        String 'guest1424'
        String '914385'
        String '12many'
        Number 0
        String 'guest'
        String ''
        String '1.0.1'
        String '0'
        String '66.6.20.167'
        String 'userkey~f1514a0f@rtype~2'
        String ''
        Object (133 items)
            AMF0 type: Object (0x03)
            Property 'AllowTips' Number 0
            Property 'TotalSeconds' Number 0
            Property 'giftsAutoMessageDelayArray' ECMA array
            Property 'sponsorid' String '0'
            Property 'bsticket' String '{i:"0j6jci4eiae089i0yq9kluqp1",t:1,v:5,e:1489713550,h:"D8a5NVxgoHusXgWwq8/lFfv7S+EkftuI+0ZatAqS/68="}'
            Property 'countryid' String '62'
            Property 'abdynprice' String '0'
            Property 'referer' String 'genericguestapp.swf'
            Property 'logmode' String '1'
            Property 'enableGifts' Boolean false
            Property 'giftNewTransOpt' String '1'
            Property 'Free2Paid' Number 0
            Property 'pa' String 'ImLive.com'
            Property 'FreeSecond' Number 0
            Property 'CanContinueChat' Boolean false
            Property 'VIPLevel' Number 0
            Property 'origin' Number 0
            Property 'ENV' Number 0
            Property 'WorkingServer' String 'cdncbr://926-f70bcbc608~c~hibcdn~net/live.fly11'
                Name: WorkingServer
                    String length: 13
                    String: WorkingServer
                String 'cdncbr://926-f70bcbc608~c~hibcdn~net/live.fly11'
                    AMF0 type: String (0x02)
                    String length: 47
                    String: cdncbr://926-f70bcbc608~c~hibcdn~net/live.fly11
            Property 'hostid' String '914385'
            Property 'isFreeUser' Number 0
            Property 'imback' Number 0
            Property 'MemberType' Number 0
            Property 'GuestName' String 'guest1424'
            Property 'hostNickName' String 'kimmylive'
            Property 'GuestID' String ''
            Property 'EnticeVideoChatMessageResult' Number 0
            Property 'isLandingPage' String 'False'
            Property 'NickName' String 'guest1424'
            Property 'FileName' String ''
            Property 'timestamp' String '1489706452'
            Property 'userkey' String ''
            Property 'hideLogo' Number 0
            Property 'Cat' String '0'
            Property 'DiscountID' Number 0
            Property 'ReturnToSession' Number 0
            Property 'mode' String 'ig3'
            Property 'GuestType' Number 2
            Property 'chat_data' Object
            Property 'hpv' String '2.8'
            Property 'wsip' String '66.6.20.167'
            Property 'ISClubMember' Number 0
            Property 'isRefundGuest' Number 0
            Property 'img' String '0385/914385/914385O1481294417.jpg'
            Property 'isGuestsHHTime' Number 0
            Property 'PriceValue' Number 0
            Property 'HHPriceValue' Number 1.48
            Property 'traffic_referrer' String ''
            Property 'IsCredit20' Number 0
            Property 'Sponsor' Number 0
            Property 'rateDebag' Number 0
            Property 'PCardStatus' Number 0
            Property 'mainimg' String ''
            Property 'useAutoMessagesLogic' Number 0
            Property 'HostSinulatorStatus' Number 0
            Property 'Timeleft' Number 0
            Property 'lastbitrate' String '5641'
            Property 'CanRecordSession' Number 0
            Property 'Login' String ''
            Property 'MatrixResult' Number 1
            Property 'isGaySite' Number 0
            Property 'IsSession' Number 0
            Property 'DontShowMe' Number 1
            Property 'Domain' String 'ImLive.com'
            Property 'cat' Number 1
            Property 'AllowRecSessionFlag' Number 0
            Property 'GuestOriginID' Number 0
            Property 'CurrentUserID' Number 0
            Property 'GiveCode' String 'yes'
            Property 'AuthCode' String '190fce916cfb247f98575aacd3cd84d5'
            Property 'HostNick' String 'kimmylive'
            Property 'CouponType' Number 0
            Property 'PriceID' Number 0
            Property 'IsFriendship' Number 0
            Property 'ChatHostID' Number 0
            Property 'BTStatus' Number 0
            Property 'SessionID' String ''
            Property 'RoomID' String '10'
            Property 'GuestOriginName' String ''
            Property 'gurl' String '/joinoptionsvcget.ashx'
            Property 'Seconds' Number 0
            Property 'AllowInpuText' Number 0
            Property 'cdnserver' String 'cbr?server1=rtmp://926-f70bcbc608.c.hibcdn.net/live'
            Property 'ShowOneclickBtn' Number 1
            Property 'vi' String '9e4da8f8-3f46-40be-a814-5d0b35fba120'
            Property 'purl' String '/joinoptionsvcpay.ashx'
            Property 'OpenPricePerMin' Number 0
            Property 'vtype' String '1'
            Property 'IsHappyHour' Number 0
            Property 'sizemode' String '2'
            Property 'autorefill' Number 0
            Property 'tmode' String '2'
            Property 'IsFree' String '1'
            Property 'hogVibratorShow' Number 0
            Property 'brate' String '336'
            Property 'HHCreditOption' Number 0
            Property 'ip' String '------------'
            Property 'sound' Number 1
            Property 'FanClubSeconds' Number 0
            Property 'osversion' String '7'
            Property 'Version' String '1.0.1'
            Property 'HHDuration' Number 0
            Property 'isCeleb' Boolean false
            Property 'IsFreeChat' Boolean true
            Property 'chatmode' Number 0
            Property 'CouponSeconds' Number 0
            Property 'LastIP' String '--------------'
            Property 'browsername' String 'Mozilla Firefox'
            Property 'rejecttime' Number 0
            Property 'devicetype' String '1'
            Property 'AllowEmoticons' String '1'
            Property 'devicename' String 'Unknown'
            Property 'isPG' String '0'
            Property 'tc' String '0'
            Property 'StageName' String ''
            Property 'setrecent' String 'userkey~f1514a0f@rtype~2'
            Property 'STAGE_NAME' String 'kimmylive'
            Property 'browserversion' String '52.0'
            Property 'vcode' String ''
            Property 'flcPopupType' String '1'
            Property 'osname' String 'Microsoft Windows'
            Property 'OpenLogin' String '0'
            Property 'IS_ANONIMUS' Boolean true
            Property 'nhsec' String '15'
            Property 'givegifts' String '0'
            Property 'rating' String '5'
            Property 'CelebEvent' Number 0
            Property 'from_page' String 'https://imlive.com/live-sex-chats/cam-girls/gallery/?lv=1'
            Property 'rated' Boolean false
            Property 'roomMsg' String 'USE MY DISCOUNTCODE: KIMLIVE1'
            Property 'optionalpvalue' Number 0
            Property 'current_page' String '/flash_sdk/freevideochatguest.aspx?hostnick=kimmylive&roomid=10'
            Property 'page' String 'https://imlive.com/swf/'
            End Of Object Marker
        String ''
        String ''
        String ''
        String ''
        String 'cdncbr://926-f70bcbc608~c~hibcdn~net/live.fly11'

**Comment by johnthecracker** [comment]
Frame 5347: 1154 bytes on wire (9232 bits), 1154 bytes captured (9232 bits) on interface 0
Ethernet II, Src: ----------------------
Internet Protocol Version 4, Src: 192.168.0.2, Dst: 66.6.18.100
Transmission Control Protocol, Src Port: 55019, Dst Port: 1935, Seq: 5634, Ack: 3074, Len: 1100
Real Time Messaging Protocol (AMF0 Command connect('coolVideo_v2/914385'))
    Response to this call in frame: 5822
    RTMP Header
    RTMP Body
        String 'connect'
        Number 1
        Object (11 items)
        String 'guest1424'
        String '914385'
        String '12many'
        Number 0
        String 'guest'
        String ''
        String '1.0.1'
        String '0'
        String '66.6.20.167'
        String 'userkey~f1514a0f@rtype~2'
        String ''
        Object (133 items)
            AMF0 type: Object (0x03)
            Property 'AllowTips' Number 0
            Property 'TotalSeconds' Number 0
            Property 'giftsAutoMessageDelayArray' ECMA array
            Property 'sponsorid' String '0'
            Property 'bsticket' String '{i:"0j6jci4eiae089i0yq9kluqp1",t:1,v:5,e:1489713550,h:"D8a5NVxgoHusXgWwq8/lFfv7S+EkftuI+0ZatAqS/68="}'
            Property 'countryid' String '62'
            Property 'abdynprice' String '0'
            Property 'referer' String 'genericguestapp.swf'
            Property 'logmode' String '1'
            Property 'enableGifts' Boolean false
            Property 'giftNewTransOpt' String '1'
            Property 'Free2Paid' Number 0
            Property 'pa' String 'ImLive.com'
            Property 'FreeSecond' Number 0
            Property 'CanContinueChat' Boolean false
            Property 'VIPLevel' Number 0
            Property 'origin' Number 0
            Property 'ENV' Number 0
            Property 'WorkingServer' String 'cdncbr://926-f70bcbc608~c~hibcdn~net/live.fly11'
                Name: WorkingServer
                    String length: 13
                    String: WorkingServer
                String 'cdncbr://926-f70bcbc608~c~hibcdn~net/live.fly11'
                    AMF0 type: String (0x02)
                    String length: 47
                    String: cdncbr://926-f70bcbc608~c~hibcdn~net/live.fly11
            Property 'hostid' String '914385'
            Property 'isFreeUser' Number 0
            Property 'imback' Number 0
            Property 'MemberType' Number 0
            Property 'GuestName' String 'guest1424'
            Property 'hostNickName' String 'kimmylive'
            Property 'GuestID' String ''
            Property 'EnticeVideoChatMessageResult' Number 0
            Property 'isLandingPage' String 'False'
            Property 'NickName' String 'guest1424'
            Property 'FileName' String ''
            Property 'timestamp' String '1489706452'
            Property 'userkey' String ''
            Property 'hideLogo' Number 0
            Property 'Cat' String '0'
            Property 'DiscountID' Number 0
            Property 'ReturnToSession' Number 0
            Property 'mode' String 'ig3'
            Property 'GuestType' Number 2
            Property 'chat_data' Object
            Property 'hpv' String '2.8'
            Property 'wsip' String '66.6.20.167'
            Property 'ISClubMember' Number 0
            Property 'isRefundGuest' Number 0
            Property 'img' String '0385/914385/914385O1481294417.jpg'
            Property 'isGuestsHHTime' Number 0
            Property 'PriceValue' Number 0
            Property 'HHPriceValue' Number 1.48
            Property 'traffic_referrer' String ''
            Property 'IsCredit20' Number 0
            Property 'Sponsor' Number 0
            Property 'rateDebag' Number 0
            Property 'PCardStatus' Number 0
            Property 'mainimg' String ''
            Property 'useAutoMessagesLogic' Number 0
            Property 'HostSinulatorStatus' Number 0
            Property 'Timeleft' Number 0
            Property 'lastbitrate' String '5641'
            Property 'CanRecordSession' Number 0
            Property 'Login' String ''
            Property 'MatrixResult' Number 1
            Property 'isGaySite' Number 0
            Property 'IsSession' Number 0
            Property 'DontShowMe' Number 1
            Property 'Domain' String 'ImLive.com'
            Property 'cat' Number 1
            Property 'AllowRecSessionFlag' Number 0
            Property 'GuestOriginID' Number 0
            Property 'CurrentUserID' Number 0
            Property 'GiveCode' String 'yes'
            Property 'AuthCode' String '190fce916cfb247f98575aacd3cd84d5'
            Property 'HostNick' String 'kimmylive'
            Property 'CouponType' Number 0
            Property 'PriceID' Number 0
            Property 'IsFriendship' Number 0
            Property 'ChatHostID' Number 0
            Property 'BTStatus' Number 0
            Property 'SessionID' String ''
            Property 'RoomID' String '10'
            Property 'GuestOriginName' String ''
            Property 'gurl' String '/joinoptionsvcget.ashx'
            Property 'Seconds' Number 0
            Property 'AllowInpuText' Number 0
            Property 'cdnserver' String 'cbr?server1=rtmp://926-f70bcbc608.c.hibcdn.net/live'
            Property 'ShowOneclickBtn' Number 1
            Property 'vi' String '9e4da8f8-3f46-40be-a814-5d0b35fba120'
            Property 'purl' String '/joinoptionsvcpay.ashx'
            Property 'OpenPricePerMin' Number 0
            Property 'vtype' String '1'
            Property 'IsHappyHour' Number 0
            Property 'sizemode' String '2'
            Property 'autorefill' Number 0
            Property 'tmode' String '2'
            Property 'IsFree' String '1'
            Property 'hogVibratorShow' Number 0
            Property 'brate' String '336'
            Property 'HHCreditOption' Number 0
            Property 'ip' String '------------'
            Property 'sound' Number 1
            Property 'FanClubSeconds' Number 0
            Property 'osversion' String '7'
            Property 'Version' String '1.0.1'
            Property 'HHDuration' Number 0
            Property 'isCeleb' Boolean false
            Property 'IsFreeChat' Boolean true
            Property 'chatmode' Number 0
            Property 'CouponSeconds' Number 0
            Property 'LastIP' String '--------------'
            Property 'browsername' String 'Mozilla Firefox'
            Property 'rejecttime' Number 0
            Property 'devicetype' String '1'
            Property 'AllowEmoticons' String '1'
            Property 'devicename' String 'Unknown'
            Property 'isPG' String '0'
            Property 'tc' String '0'
            Property 'StageName' String ''
            Property 'setrecent' String 'userkey~f1514a0f@rtype~2'
            Property 'STAGE_NAME' String 'kimmylive'
            Property 'browserversion' String '52.0'
            Property 'vcode' String ''
            Property 'flcPopupType' String '1'
            Property 'osname' String 'Microsoft Windows'
            Property 'OpenLogin' String '0'
            Property 'IS_ANONIMUS' Boolean true
            Property 'nhsec' String '15'
            Property 'givegifts' String '0'
            Property 'rating' String '5'
            Property 'CelebEvent' Number 0
            Property 'from_page' String 'https://imlive.com/live-sex-chats/cam-girls/gallery/?lv=1'
            Property 'rated' Boolean false
            Property 'roomMsg' String 'USE MY DISCOUNTCODE: KIMLIVE1'
            Property 'optionalpvalue' Number 0
            Property 'current_page' String '/flash_sdk/freevideochatguest.aspx?hostnick=kimmylive&roomid=10'
            Property 'page' String 'https://imlive.com/swf/'
            End Of Object Marker
        String ''
        String ''
        String ''
        String ''
        String 'cdncbr://926-f70bcbc608~c~hibcdn~net/live.fly11'

**Comment by johnthecracker** [comment]
Frame 5347: 1154 bytes on wire (9232 bits), 1154 bytes captured (9232 bits) on interface 0
Ethernet II, Src: ----------------------
Internet Protocol Version 4, Src: 192.168.0.2, Dst: 66.6.18.100
Transmission Control Protocol, Src Port: 55019, Dst Port: 1935, Seq: 5634, Ack: 3074, Len: 1100
Real Time Messaging Protocol (AMF0 Command connect('coolVideo_v2/914385'))
    Response to this call in frame: 5822
    RTMP Header
    RTMP Body
        String 'connect'
        Number 1
        Object (11 items)
        String 'guest1424'
        String '914385'
        String '12many'
        Number 0
        String 'guest'
        String ''
        String '1.0.1'
        String '0'
        String '66.6.20.167'
        String 'userkey~f1514a0f@rtype~2'
        String ''
        Object (133 items)
            AMF0 type: Object (0x03)
            Property 'AllowTips' Number 0
            Property 'TotalSeconds' Number 0
            Property 'giftsAutoMessageDelayArray' ECMA array
            Property 'sponsorid' String '0'
            Property 'bsticket' String '{i:"0j6jci4eiae089i0yq9kluqp1",t:1,v:5,e:1489713550,h:"D8a5NVxgoHusXgWwq8/lFfv7S+EkftuI+0ZatAqS/68="}'
            Property 'countryid' String '62'
            Property 'abdynprice' String '0'
            Property 'referer' String 'genericguestapp.swf'
            Property 'logmode' String '1'
            Property 'enableGifts' Boolean false
            Property 'giftNewTransOpt' String '1'
            Property 'Free2Paid' Number 0
            Property 'pa' String 'ImLive.com'
            Property 'FreeSecond' Number 0
            Property 'CanContinueChat' Boolean false
            Property 'VIPLevel' Number 0
            Property 'origin' Number 0
            Property 'ENV' Number 0
            Property 'WorkingServer' String 'cdncbr://926-f70bcbc608~c~hibcdn~net/live.fly11'
                Name: WorkingServer
                    String length: 13
                    String: WorkingServer
                String 'cdncbr://926-f70bcbc608~c~hibcdn~net/live.fly11'
                    AMF0 type: String (0x02)
                    String length: 47
                    String: cdncbr://926-f70bcbc608~c~hibcdn~net/live.fly11
            Property 'hostid' String '914385'
            Property 'isFreeUser' Number 0
            Property 'imback' Number 0
            Property 'MemberType' Number 0
            Property 'GuestName' String 'guest1424'
            Property 'hostNickName' String 'kimmylive'
            Property 'GuestID' String ''
            Property 'EnticeVideoChatMessageResult' Number 0
            Property 'isLandingPage' String 'False'
            Property 'NickName' String 'guest1424'
            Property 'FileName' String ''
            Property 'timestamp' String '1489706452'
            Property 'userkey' String ''
            Property 'hideLogo' Number 0
            Property 'Cat' String '0'
            Property 'DiscountID' Number 0
            Property 'ReturnToSession' Number 0
            Property 'mode' String 'ig3'
            Property 'GuestType' Number 2
            Property 'chat_data' Object
            Property 'hpv' String '2.8'
            Property 'wsip' String '66.6.20.167'
            Property 'ISClubMember' Number 0
            Property 'isRefundGuest' Number 0
            Property 'img' String '0385/914385/914385O1481294417.jpg'
            Property 'isGuestsHHTime' Number 0
            Property 'PriceValue' Number 0
            Property 'HHPriceValue' Number 1.48
            Property 'traffic_referrer' String ''
            Property 'IsCredit20' Number 0
            Property 'Sponsor' Number 0
            Property 'rateDebag' Number 0
            Property 'PCardStatus' Number 0
            Property 'mainimg' String ''
            Property 'useAutoMessagesLogic' Number 0
            Property 'HostSinulatorStatus' Number 0
            Property 'Timeleft' Number 0
            Property 'lastbitrate' String '5641'
            Property 'CanRecordSession' Number 0
            Property 'Login' String ''
            Property 'MatrixResult' Number 1
            Property 'isGaySite' Number 0
            Property 'IsSession' Number 0
            Property 'DontShowMe' Number 1
            Property 'Domain' String 'ImLive.com'
            Property 'cat' Number 1
            Property 'AllowRecSessionFlag' Number 0
            Property 'GuestOriginID' Number 0
            Property 'CurrentUserID' Number 0
            Property 'GiveCode' String 'yes'
            Property 'AuthCode' String '190fce916cfb247f98575aacd3cd84d5'
            Property 'HostNick' String 'kimmylive'
            Property 'CouponType' Number 0
            Property 'PriceID' Number 0
            Property 'IsFriendship' Number 0
            Property 'ChatHostID' Number 0
            Property 'BTStatus' Number 0
            Property 'SessionID' String ''
            Property 'RoomID' String '10'
            Property 'GuestOriginName' String ''
            Property 'gurl' String '/joinoptionsvcget.ashx'
            Property 'Seconds' Number 0
            Property 'AllowInpuText' Number 0
            Property 'cdnserver' String 'cbr?server1=rtmp://926-f70bcbc608.c.hibcdn.net/live'
            Property 'ShowOneclickBtn' Number 1
            Property 'vi' String '9e4da8f8-3f46-40be-a814-5d0b35fba120'
            Property 'purl' String '/joinoptionsvcpay.ashx'
            Property 'OpenPricePerMin' Number 0
            Property 'vtype' String '1'
            Property 'IsHappyHour' Number 0
            Property 'sizemode' String '2'
            Property 'autorefill' Number 0
            Property 'tmode' String '2'
            Property 'IsFree' String '1'
            Property 'hogVibratorShow' Number 0
            Property 'brate' String '336'
            Property 'HHCreditOption' Number 0
            Property 'ip' String '------------'
            Property 'sound' Number 1
            Property 'FanClubSeconds' Number 0
            Property 'osversion' String '7'
            Property 'Version' String '1.0.1'
            Property 'HHDuration' Number 0
            Property 'isCeleb' Boolean false
            Property 'IsFreeChat' Boolean true
            Property 'chatmode' Number 0
            Property 'CouponSeconds' Number 0
            Property 'LastIP' String '--------------'
            Property 'browsername' String 'Mozilla Firefox'
            Property 'rejecttime' Number 0
            Property 'devicetype' String '1'
            Property 'AllowEmoticons' String '1'
            Property 'devicename' String 'Unknown'
            Property 'isPG' String '0'
            Property 'tc' String '0'
            Property 'StageName' String ''
            Property 'setrecent' String 'userkey~f1514a0f@rtype~2'
            Property 'STAGE_NAME' String 'kimmylive'
            Property 'browserversion' String '52.0'
            Property 'vcode' String ''
            Property 'flcPopupType' String '1'
            Property 'osname' String 'Microsoft Windows'
            Property 'OpenLogin' String '0'
            Property 'IS_ANONIMUS' Boolean true
            Property 'nhsec' String '15'
            Property 'givegifts' String '0'
            Property 'rating' String '5'
            Property 'CelebEvent' Number 0
            Property 'from_page' String 'https://imlive.com/live-sex-chats/cam-girls/gallery/?lv=1'
            Property 'rated' Boolean false
            Property 'roomMsg' String 'USE MY DISCOUNTCODE: KIMLIVE1'
            Property 'optionalpvalue' Number 0
            Property 'current_page' String '/flash_sdk/freevideochatguest.aspx?hostnick=kimmylive&roomid=10'
            Property 'page' String 'https://imlive.com/swf/'
            End Of Object Marker
        String ''
        String ''
        String ''
        String ''
        String 'cdncbr://926-f70bcbc608~c~hibcdn~net/live.fly11'

**Comment by johnthecracker** [comment]
rtmpdump -v -r "rtmp://926-f70bcbc608.c.hibcdn.net/live" ^
-a "live" ^
-f "WIN 25,0,0,127" ^
-W "https://imlive.com/swf/genericguestapp.swf" ^
-p "https://imlive.com/flash_sdk/freevideochatguest.aspx?hostnick=jessieblonde&room id=10" ^
-y "coolvisionrtmp3_jessieblonde" ^
-o test.flv


C:\>rtmpdump -v -r "rtmp://926-f70bcbc608.c.hibcdn.net/live" -a "live" -f "WIN 25,0,0,127" -W "https://imlive.com/swf/ge
nericguestapp.swf" -p "https://imlive.com/flash_sdk/freevideochatguest.aspx?hostnick=jessieblonde&room id=10" -y "coolvis
ionrtmp3_jessieblonde" -o test.flv
RTMPDump v2.4 GIT-2015-12-14 (Compiled by KSV)
(c) 2010 Andrej Stepanchuk, Howard Chu, The Flvstreamer Team; license: GPL
Connecting ...
INFO: Connected...
Starting Live Stream
90481.667 kB / 2787.68 sec

**Comment by johnthecracker** [comment]
C:\>ffmpeg -i "rtmp://926-f70bcbc608.c.hibcdn.net/live//coolvisionrtmp3_fullcumshow" -c copy c:\fullcumshow.flv
ffmpeg version 3.2.4 Copyright (c) 2000-2017 the FFmpeg developers
  built with gcc 6.3.0 (GCC)
  configuration: --enable-gpl --enable-version3 --enable-d3d11va --enable-dxva2 --enable-libmfx --enable-nvenc --enable-
avisynth --enable-bzlib --enable-fontconfig --enable-frei0r --enable-gnutls --enable-iconv --enable-libass --enable-libb
luray --enable-libbs2b --enable-libcaca --enable-libfreetype --enable-libgme --enable-libgsm --enable-libilbc --enable-l
ibmodplug --enable-libmp3lame --enable-libopencore-amrnb --enable-libopencore-amrwb --enable-libopenh264 --enable-libope
njpeg --enable-libopus --enable-librtmp --enable-libsnappy --enable-libsoxr --enable-libspeex --enable-libtheora --enabl
e-libtwolame --enable-libvidstab --enable-libvo-amrwbenc --enable-libvorbis --enable-libvpx --enable-libwavpack --enable
-libwebp --enable-libx264 --enable-libx265 --enable-libxavs --enable-libxvid --enable-libzimg --enable-lzma --enable-zli
b
  libavutil      55. 34.101 / 55. 34.101
  libavcodec     57. 64.101 / 57. 64.101
  libavformat    57. 56.101 / 57. 56.101
  libavdevice    57.  1.100 / 57.  1.100
  libavfilter     6. 65.100 /  6. 65.100
  libswscale      4.  2.100 /  4.  2.100
  libswresample   2.  3.100 /  2.  3.100
  libpostproc    54.  1.100 / 54.  1.100
[flv @ 000000000053a480] video stream discovered after head already parsed
[flv @ 000000000053a480] audio stream discovered after head already parsed
Input #0, flv, from 'rtmp://926-f70bcbc608.c.hibcdn.net/live//coolvisionrtmp3_fullcumshow':
  Duration: N/A, start: 3284.024000, bitrate: N/A
    Stream #0:0: Video: h264 (Main), yuv420p(tv, progressive), 640x480 [SAR 1:1 DAR 4:3], 30.30 fps, 30 tbr, 1k tbn, 60
tbc
    Stream #0:1: Audio: nellymoser, 11025 Hz, mono, flt
Output #0, flv, to 'c:\fullcumshow.flv':
  Metadata:
    encoder         : Lavf57.56.101
    Stream #0:0: Video: h264 (Main) ([7][0][0][0] / 0x0007), yuv420p(tv, progressive), 640x480 [SAR 1:1 DAR 4:3], q=2-31
, 30.30 fps, 30 tbr, 1k tbn, 1k tbc
    Stream #0:1: Audio: nellymoser ([6][0][0][0] / 0x0006), 11025 Hz, mono
Stream mapping:
  Stream #0:0 -> #0:0 (copy)
  Stream #0:1 -> #0:1 (copy)
Press [q] to stop, [?] for help
frame=  437 fps= 22 q=-1.0 size=    1783kB time=00:00:21.83 bitrate= 669.2kbits/s speed= 1.1x

**Comment by gravyboat** [comment]
Did you mean to close this @johnthecracker?

**Comment by johnthecracker** [comment]
I think that there is lack of interest within streamlink comunity in this website so I closed this.

a-pac.tv is more interesting from technical point of view.

There are a few threads here about sites  similar to ImLive, so if there is anybody particularly interested in
ImLive, new thread will show up in time.

**Comment by beardypig** [comment]
What were the dynamic HTTP blocks? They sound technically interesting... 
This plugin should be straight forward with RTMP, I believe it is acceptable for it to only work with KSV's version of `rtmpdump`. `mips.tv` apparently only works with KSV's `rtmpdump`, says so in the docs.

**Comment by johnthecracker** [comment]
Here are 2 consecutive raws from httpfox, extension for firefox.

Each chunk is playable with VLC, 10 seconds per chunk.


00:10:07.804	4.389	415	1.5M	GET	200	video/mp4	https://streamer16.wlmediahub.com/flc/994052/greeneyesgirl_0.mp4?a=0.4793290225788951
00:10:21.302	0.888	415	1.4M	GET	200	video/mp4	https://streamer16.wlmediahub.com/flc/994052/greeneyesgirl_0.mp4?a=0.2616274659521878

**Comment by beardypig** [comment]
Interesting @johnthecracker... must the be `a` parameter that is the mega key... 

For the RTMP parameters, I imagine they are being sent over HTTP via some API - although it could be done via RTMP, which would make it next to impossible to add to `streamlink` with some serious work :D

**Comment by johnthecracker** [comment]
https://imlive.com/flash_sdk/freevideochatguest.aspx?hostnick=vanessza_&roomid=10

7611	17.739861	192.168.0.2	66.6.18.200	RTMP	2361	connect('coolVideo_v2/1075549')


Frame 7611: 2361 bytes on wire (18888 bits), 2361 bytes captured (18888 bits) on interface 0
Ethernet II, Src: AsustekC_ab:cd:ef (12:34:56:78:90:12), Dst: Netgear_bb:34:56 (12:34:56:78:90:12)
Internet Protocol Version 4, Src: 192.168.0.2, Dst: 66.6.18.200
Transmission Control Protocol, Src Port: 63883, Dst Port: 1935, Seq: 4374, Ack: 3074, Len: 2307
Real Time Messaging Protocol (AMF0 Command connect('coolVideo_v2/1075549'))
    Response to this call in frame: 7621
    RTMP Header
    RTMP Body
        String 'connect'
        Number 1
        Object (11 items)
            AMF0 type: Object (0x03)
            Property 'app' String 'coolVideo_v2/1075549'
            Property 'flashVer' String 'WIN 25,0,0,171'
            Property 'swfUrl' String 'https://imlive.com/swf/genericguestapp.swf'
            Property 'tcUrl' String 'rtmp://fly20.globalmailer.com/coolVideo_v2/1075549'
            Property 'fpad' Boolean false
            Property 'capabilities' Number 239
            Property 'audioCodecs' Number 3575
            Property 'videoCodecs' Number 252
            Property 'videoFunction' Number 1
            Property 'pageUrl' String 'https://imlive.com/flash_sdk/freevideochatguest.aspx?hostnick=vanessza_&roomid=10'
            Property 'objectEncoding' Number 0
            End Of Object Marker
        String 'guest8757'
        String '1075549'
        String '12many'
        Number 0
        String 'guest'
        String ''
        String '1.0.1'
        String '0'
        String '66.6.20.166'
        String 'userkey~24ea528f@rtype~2'
        String ''
        Object (132 items)
            AMF0 type: Object (0x03)
            Property 'purl' String '/joinoptionsvcpay.ashx'
            Property 'current_page' String '/flash_sdk/freevideochatguest.aspx?hostnick=vanessza_&roomid=10'
            Property 'from_page' String 'https://imlive.com/live-sex-chats/cam-girls/gallery/?lv=1'
            Property 'FileName' String ''
            Property 'bsticket' String '{i:"45mm6mf1gzis5duatv7yhdon2",t:1,v:4,e:1495154437,h:"bETcTg+RtnvqDWZgBJ2gXpURgsBm+xdKsxOungq6rxg="}'
            Property 'IS_ANONIMUS' Boolean true
            Property 'NickName' String 'guest8757'
            Property 'MemberType' Number 0
            Property 'GiveCode' String 'yes'
            Property 'CelebEvent' Number 0
            Property 'countryid' String '62'
            Property 'imback' Number 0
            Property 'isFreeUser' Number 0
            Property 'abdynprice' String '0'
            Property 'logmode' String '1'
            Property 'StageName' String ''
            Property 'enableGifts' Boolean false
            Property 'page' String 'https://imlive.com/swf/'
            Property 'sponsorid' String '0'
            Property 'giftNewTransOpt' String '1'
            Property 'AllowTips' Number 0
            Property 'referer' String 'genericguestapp.swf'
            Property 'PriceID' Number 0
            Property 'TotalSeconds' Number 0
            Property 'Free2Paid' Number 0
            Property 'HostNick' String 'Vanessza_'
            Property 'pa' String 'ImLive.com'
            Property 'PriceValue' Number 0
            Property 'VIPLevel' Number 0
            Property 'HHPriceValue' Number 1.48
            Property 'FreeSecond' Number 0
            Property 'mainimg' String ''
            Property 'WorkingServer' String 'cdnifl://ams01~eventorigin~influxis~com/imleu.fly20'
            Property 'origin' Number 0
            Property 'Timeleft' Number 0
            Property 'hostNickName' String 'Vanessza_'
            Property 'GuestOriginName' String ''
            Property 'hostid' String '1075549'
            Property 'GuestOriginID' Number 0
            Property 'GuestName' String 'guest8757'
            Property 'timestamp' String '1596143229'
            Property 'optionalpvalue' Number 0
            Property 'CouponType' Number 0
            Property 'isLandingPage' String 'False'
            Property 'Seconds' Number 0
            Property 'giftsAutoMessageDelayArray' ECMA array
            Property 'BTStatus' Number 0
            Property 'GuestID' String ''
            Property 'ip' String 'my.ip.address.'
            Property 'mode' String 'ig3'
            Property 'IsSession' Number 0
            Property 'wsip' String '66.6.20.166'
            Property 'hpv' String '3.8'
            Property 'AllowInpuText' Number 0
            Property 'DontShowMe' Number 1
            Property 'img' String '0549/1075549/1075549O1426579194.jpg'
            Property 'ShowOneclickBtn' Number 1
            Property 'IsHappyHour' Number 0
            Property 'autorefill' Number 0
            Property 'hideLogo' Number 0
            Property 'brate' String '711'
            Property 'STAGE_NAME' String 'Vanessza '
            Property 'lastbitrate' String '1000'
            Property 'HHCreditOption' Number 0
            Property 'cdnserver' String 'ifl?server1=rtmp://cdn.influxis.net/imleu'
            Property 'sizemode' String '2'
            Property 'IsFreeChat' Boolean true
            Property 'RoomID' String '10'
            Property 'userkey' String ''
            Property 'isCeleb' Boolean false
            Property 'AuthCode' String 'b5b75ca89b0b72e6c3d3be44efea311e'
            Property 'chatmode' Number 0
            Property 'LastIP' String 'my.ip.address.'
            Property 'CanRecordSession' Number 0
            Property 'rejecttime' Number 0
            Property 'IsFree' String '1'
            Property 'tmode' String '2'
            Property 'vtype' String '1'
            Property 'sound' Number 1
            Property 'vi' String '1e19f2c1-9f57-41ed-b6e1-343bcf12bc53'
            Property 'HHDuration' Number 0
            Property 'rated' Boolean false
            Property 'FanClubSeconds' Number 0
            Property 'IsFriendship' Number 0
            Property 'Cat' String '0'
            Property 'DiscountID' Number 0
            Property 'Version' String '1.0.1'
            Property 'ReturnToSession' Number 0
            Property 'GuestType' Number 2
            Property 'isRefundGuest' Number 0
            Property 'osversion' String '7'
            Property 'isGuestsHHTime' Number 0
            Property 'osname' String 'Microsoft Windows'
            Property 'browsername' String 'Mozilla Firefox'
            Property 'useAutoMessagesLogic' Number 0
            Property 'chat_data' Object
            Property 'IsCredit20' Number 0
            Property 'Domain' String 'ImLive.com'
            Property 'traffic_referrer' String ''
            Property 'PCardStatus' Number 0
            Property 'rateDebag' Number 0
            Property 'HostSinulatorStatus' Number 0
            Property 'devicetype' String '1'
            Property 'Sponsor' Number 0
            Property 'browserversion' String 'Unknown'
            Property 'devicename' String 'Unknown'
            Property 'Login' String ''
            Property 'ISClubMember' Number 0
            Property 'SessionID' String ''
            Property 'isGaySite' Number 0
            Property 'cat' Number 1
            Property 'gurl' String '/joinoptionsvcget.ashx'
            Property 'MatrixResult' Number 1
            Property 'CurrentUserID' Number 0
            Property 'AllowEmoticons' String '1'
            Property 'setrecent' String 'userkey~24ea528f@rtype~2'
            Property 'isPG' String '0'
            Property 'AllowRecSessionFlag' Number 0
            Property 'tc' String '0'
            Property 'vcode' String ''
            Property 'EnticeVideoChatMessageResult' Number 0
            Property 'flcPopupType' String '1'
            Property 'OpenLogin' String '0'
            Property 'CanContinueChat' Boolean false
            Property 'nhsec' String '15'
            Property 'OpenPricePerMin' Number 0
            Property 'CouponSeconds' Number 0
            Property 'givegifts' String '0'
            Property 'ChatHostID' Number 0
            Property 'rating' String '5'
            Property 'ENV' Number 0
            Property 'roomMsg' String ''
            End Of Object Marker
        String ''
            AMF0 type: String (0x02)
            String length: 0
        String ''
            AMF0 type: String (0x02)
            String length: 0
        String ''
            AMF0 type: String (0x02)
            String length: 0
        String ''
            AMF0 type: String (0x02)
            String length: 0
        String 'cdnifl://ams01~eventorigin~influxis~com/imleu.fly20'
            AMF0 type: String (0x02)
            String length: 51
            String: cdnifl://ams01~eventorigin~influxis~com/imleu.fly20




7704	20.359576	66.6.18.200	192.168.0.2	RTMP	220	onStatus('NetStream.Play.Start')


Frame 7704: 220 bytes on wire (1760 bits), 220 bytes captured (1760 bits) on interface 0
Ethernet II, Src: Netgear_bb:34:56 (12:34:56:78:90:12), Dst: AsustekC_ab:cd:ef (12:34:56:78:90:12)
Internet Protocol Version 4, Src: 66.6.18.200, Dst: 192.168.0.2
Transmission Control Protocol, Src Port: 1935, Dst Port: 63883, Seq: 7174, Ack: 6885, Len: 166
Real Time Messaging Protocol (AMF0 Command onStatus('NetStream.Play.Start'))
    RTMP Header
    RTMP Body
        String 'onStatus'
        Number 0
        Null
        Object (5 items)
            AMF0 type: Object (0x03)
            Property 'level' String 'status'
            Property 'code' String 'NetStream.Play.Start'
            Property 'description' String 'Started playing vanessza_.'
            Property 'details' String 'vanessza_'
            Property 'clientid' String 'oAAUADAA'
            End Of Object Marker
